id,query,answers
PPM1_850,What is the material of the wall?,"[""It's not specified in the description but is inferred to be plaster or a similar material for a wall painting.""]"
PPM1_850,What style is the chandelier?,['Ili style']
PPM1_879,"Based on the image, what materials might be present?","['Stone or brick (for the wall)', 'Possibly plaster or paint (for the artwork)']"
PPM1_879,What artistic style is associated with the image?,['Ili style']
PPM1_879,What is depicted in the 'white top Zone' of the wall section?,"['A newsstand', 'Parts of pillars topped with terminal cups']"
PPM1_879,What is the condition of the depicted wall section?,"['Damaged or fragmented', 'Shows signs of age and deterioration', 'Parts of the painting are missing or obscured.']"
PPM1_879,What is the subject of the image?,"['A wall section from a peristyle, specifically section E.N.', 'A fragment of an ancient wall painting showing architectural elements.']"
PPM1_879,What kind of architectural feature is a 'peristyle'?,"['A courtyard surrounded by colonnades, typically found in ancient Roman or Greek buildings.']"
PPM1_879,What seems to be the central feature in the image's middle ground?,['A pillar or column']
PPM1_884,What is the style of the architectural elements?,['III style']
PPM1_884,What is the material or appearance of the wall in the image?,"['A rough, textured wall, appearing aged and possibly damaged.', 'The wall appears to be made of a concrete or stone material, with visible cracks and deterioration.']"
PPM1_884,What is the meaning of 'surmounted by a cup and a cup' in the description?,['It means that each column or pillar has a cup-shaped object positioned on top.']
PPM1_884,What is the overall tone or mood of the image?,"['Black and white, creating a somber, somewhat austere atmosphere.', 'The image evokes a sense of age, decay, and perhaps historical significance.']"
PPM1_884,What is the subject of the image?,"['Two columns or pillars with cup-like objects on top.', 'Architectural elements, possibly from a peristyle.']"
PPM1_884,What might the image depict?,"['Architectural remnants from an ancient structure, potentially Roman or similar.', 'Part of a larger archaeological find.']"
PPM1_988,What architectural element is described as having a 'cuspidato' framework?,['newsstand rale cent with framework cuspidato']
PPM1_988,What colors are mentioned in the description of the wall painting?,"['black', 'red', 'white', 'yellow']"
PPM1_988,What decorative elements are present in the frieze above the panels?,"['garlands', 'square medallions']"
PPM1_988,What is located in the central cartoon panel?,"['dead nature, figs and grapes']"
PPM1_988,What is the location of the depicted painting within the building?,"['Triclinio (b), wall N']"
PPM1_988,What is the main subject of the central panel in the median zone?,['Hercules in the garden of the Hesperides']
PPM1_988,What is the plinth made of?,['black and black socket']
PPM1_988,What kind of frame surrounds the painting?,"['molded stucco frame', 'bezel with faced peacocks and vase']"
PPM1_988,What motifs are depicted in the side panels?,"['cupids', 'Dionysus']"
PPM1_988,What style of Roman painting is depicted in the image?,"['III style, Phase IIB']"
PPM1_992,What are the side panels decorated with?,"['Cartoons (amorini, Psychai)', 'Amorini and Psychai']"
PPM1_992,What color is the wall plinth?,['Black']
PPM1_992,What decorative elements are found above the white frieze?,['Panels with tense (possibly referring to stretched fabric or similar) interrupted by medallion garland']
PPM1_992,What decorative elements are mentioned in the large black border of the median zone?,"['Candelabra with tambourine hung, horizontal taut garlands']"
PPM1_992,What is depicted in the central panel of the median zone in the image?,"['A scene that appears to be the Fall of Icarus.', 'A kiosk with a framework depicting the Fall of Icarus']"
PPM1_992,What is the color of the upper zone?,['Yellow']
PPM1_992,What is the lower part of the wall called?,['Plinth']
PPM1_992,What is the main structural division of the wall decoration?,"['Plinth, median zone, and upper zone', 'Three horizontal zones']"
PPM1_992,What is the room depicted in the image called?,['Triclinio (b)']
PPM2_1000,What architectural element separates the panels in the median zone?,['Architectural glimpses on a white background with a yellow partition and corolla in the centre']
PPM2_1000,What is depicted in the central aedicule of the upper white area?,['Hvmenaios']
PPM2_1000,What is depicted in the central panel of the red plinth in the image?,['Dolphins']
PPM2_1000,What is depicted in the lateral panels of the red plinth?,['Garlands']
PPM2_1000,What is found in the lateral vignettes of the median zone?,['Amorino (putto)']
PPM2_1000,What is the location of this wall painting within the building?,"['Triclinium (10), E wall, S section with splayed window']"
PPM2_1000,What other elements are present in the upper white area besides the aedicules?,"['Small pictures, garlands, carpet borders']"
PPM2_1000,What scene is depicted in the central painting of the median zone?,['Artemis and Actaeon']
PPM2_1000,What style of painting is this wall painting from?,['IV style']
PPM2_1000,What type of frame surrounds the entire wall painting?,['Molded stucco frame']
PPM2_1004,What is the style of the artwork?,['IV style']
PPM2_1004,What appears to be in the cupid's hand?,"['A small object, possibly a cup or flower.', 'An indistinct object that could be interpreted as a musical instrument or a flower.']"
PPM2_1004,What is depicted in the image?,"['A winged cherub or cupid.', 'A vignette of a cupid.', 'A small sculpture of a cupid.']"
PPM2_1004,What is the height of the cupid in the vignette?,['21.5 cm']
PPM2_1004,What is the overall tone or feeling of the image?,"['Dark and somewhat somber due to the grayscale and the age of the piece.', 'Mysterious and somewhat melancholic due to the pose and the muted colors.']"
PPM2_1004,What medium seems to have been used to create the image?,"['It appears to be a photographic reproduction of a sculpture, possibly a rubbing or a photogram.', ""It's difficult to determine the exact medium from the image alone, but it's likely a form of photography or a print-based representation of a three-dimensional object.""]"
PPM2_1160,Describe the overall condition of the painting based on the image.,"['The painting appears to be somewhat damaged or faded; details are not perfectly clear.', 'It shows signs of age and wear.']"
PPM2_1160,What is depicted in the image?,"['Two cupids playing ball.', 'A painting of two cupids playing a game of ball (possibly pilicrepi).']"
PPM2_1160,What is the background color of the painting?,['Red']
PPM2_1160,What is the location of this painting within the larger structure?,"['Oecus (4), N wall, W side panel']"
PPM2_1160,What is the term 'Oecus' referring to in this context?,"['A room, likely a living or reception room in a Roman house.']"
PPM2_1160,What type of game are the cupids playing?,"['A ball game, possibly pilicrepi.']"
PPM2_1164,Describe the condition of the painting in the image.,"['The image is somewhat faded and difficult to see clearly; it appears worn or damaged.', 'The details are blurry and lack sharp definition.']"
PPM2_1164,What is depicted in the painting?,"['A kneeling Cupid shooting an arrow at a rampant stag.', 'A scene alluding to Diana, the huntress.']"
PPM2_1164,What is the background color of the painting?,['Red']
PPM2_1164,What is the medium of the painting?,['Likely a fresco or other type of wall painting']
PPM2_1164,What is the overall shape of the painted area?,"['Rectangular, within a frame/border']"
PPM2_1164,What mythological figure does the scene allude to?,"['Diana, the huntress']"
PPM2_1175,What animal is the cupid chasing?,['A hare']
PPM2_1175,What is depicted in the image?,"['A poorly preserved painting of a cupid chasing a hare.', 'A scene showing a cupid pursuing a hare, possibly related to Aphrodite.']"
PPM2_1175,What is the background color of the painting?,"['Red', 'A red background, though now poorly visible due to decay.']"
PPM2_1175,What is the condition of the painting?,"['Poor state of conservation', 'The colors are decaying and the painting is difficult to see clearly.']"
PPM2_1175,What lighting condition improves visibility of the painting?,"['Grazing light', 'Light at a low angle']"
PPM2_1175,Which goddess is the hare associated with?,['Aphrodite']
PPM2_1175,Why might grazing light be beneficial for viewing the painting?,"['Because the decaying colors stand out in relief under grazing light, making them easier to see.']"
PPM2_1176,"What is the overall style or period of the painting, based on the image?","['It is difficult to determine the exact style without clearer detail; however, the subject matter suggests a possible classical or Roman influence.']"
PPM2_1176,What figures or objects are visible in the painting?,"['A cupid and an animal', 'A cupid watering an animal']"
PPM2_1176,What is depicted in the image?,"['A damaged painting on a red background showing a cupid watering an animal.', 'A fragment of a wall painting, possibly showing a cupid and an animal.']"
PPM2_1176,What is the background color of the painting?,['Red']
PPM2_1176,What is the condition of the painting?,"['Damaged', 'Partially preserved', 'Much of it is destroyed or obscured.']"
PPM2_1176,What type of surface is the painting on?,['A wall']
PPM2_1218,What is the location of this pillar?,"['Pillar N between the caupona and the atrium.', 'In an atrium (Atrium 2)']"
PPM2_1218,What does 'caupona' likely refer to?,"['An inn', 'A tavern', 'A type of Roman establishment']"
PPM2_1218,What is depicted in the image?,"['A black and white photograph of a weathered pillar with a faded fresco of a cupid.', 'A section of a wall with a partially preserved fresco showing a flying cupid.']"
PPM2_1218,What is the background color of the fresco?,"['White', 'A faded, light-colored background']"
PPM2_1218,What is the condition of the fresco?,"['Faded', 'Partially preserved', 'Weathered', 'Damaged']"
PPM2_1218,What is the figure depicted in the fresco?,"['A cupid', 'A winged figure, possibly a cherub']"
PPM2_1218,What is visible in the background of the image besides the pillar?,"['Part of a metal gate or fence', 'A metal mesh or screen']"
PPM2_1218,What material appears to be the pillar itself?,"['Stone', 'Concrete', 'A type of plaster']"
PPM2_1231,"Based on the description, what can you infer about the artistic style of the painting?","[""It belongs to the Third Pompeian style, characterized by a specific workshop's style also present in the House of M. Lucretius Pronto."", 'The painting shows stylistic similarities to other paintings in the same house and another house, suggesting a shared artistic origin.']"
PPM2_1231,Describe Theseus's posture and attire in the painting.,"['Theseus is depicted naked, with his right hand raised, presumably to receive the thread. His clothes are placed at his feet.']"
PPM2_1231,How does the condition of the painting affect our interpretation of the composition and content?,"['The damaged state of the painting makes it difficult to ascertain precise details, but the main narrative elements are still discernable.']"
PPM2_1231,How is Ariadne depicted in the painting?,"['Ariadne is seen from behind, holding the ball of thread in her left hand.']"
PPM2_1231,What is suggested by the placement of Theseus's clothes at his feet?,"['It suggests preparation for entering the labyrinth, a readiness for action.', ""It emphasizes his vulnerability and reliance on Ariadne's help.""]"
PPM2_1231,What is the central focus of the painting?,['Theseus receiving a thread from Ariadne.']
PPM2_1231,What is the overall compositional arrangement of the figures in the painting?,"[""Theseus is positioned prominently, receiving the thread from Ariadne who is somewhat behind him.  The clothing forms a base at Theseus's feet.""]"
PPM2_1231,What is the significance of the thread in the context of the painting?,"[""The thread is likely Ariadne's, given to Theseus to help him navigate the labyrinth and escape the Minotaur.""]"
PPM2_1288,What is depicted in the vignette?,['A cupid in flight']
PPM2_1288,What is the likely purpose of the scratched outline?,['A preparatory sketch for the painting.']
PPM2_1288,What technique was used to create the outline of the cupid?,['Scratching']
PPM2_1288,Why is the outline visible?,"['The colors have fallen, revealing the preparatory sketch.']"
PPM2_1292,What can be inferred about the style of the wall painting?,"['It seems to have incorporated a landscape scene as a central element.', 'Based on the remaining fragments, it may have been relatively elaborate in its design.']"
PPM2_1292,What is depicted in the image?,"['A fragment of a painted wall from an ancient building (possibly an Oecus).', 'A section of a wall showing remnants of a landscape painting and other decorative elements.', 'A damaged wall painting with a largely illegible central landscape.']"
PPM2_1292,What is mentioned about the decorative scheme?,"[""It's described as 'identical' to that of the 'E wall', even with the presence of a door."", 'This suggests a planned decorative pattern that was consistent despite architectural features.']"
PPM2_1292,What is the 'holed wall' mentioned in the description?,"['It likely refers to a wall that had a hole (or door) in it during antiquity.', 'The presence of the hole did not affect the overall decorative design.']"
PPM2_1292,What is the condition of the wall painting?,"['It is heavily damaged and fragmented.', 'Much of the original painting, especially the central landscape, is illegible or missing.', 'The remaining parts are worn and faded.']"
PPM2_1292,What is the significance of the phrase 'Oecus (3)'?,"['It likely refers to the location of the wall within a larger structure, specifically the third Oecus.', ""It suggests that this is one of several similar wall fragments found within the same building's Oecus spaces.""]"
PPM2_154,"What artistic technique is used in the image, as suggested by the description?",['Vignette']
PPM2_154,What does 'pedum' refer to in this context?,"[""A shepherd's crook or staff, an object held by the cupid in the image.""]"
PPM2_154,What is depicted in the image?,"['A fresco or painting of a cupid in flight.', ""A cupid holding what appears to be a pedum (a shepherd's crook).""]"
PPM2_154,What is the color of the background mentioned in the description?,['Yellow']
PPM2_154,What is the general style of the artwork?,"['Classical, possibly Roman, given the subject matter of a Cupid.']"
PPM2_154,What is the location of the image as indicated by the description?,"['Cubicle (3), wall N, section W']"
PPM2_154,What is the overall condition of the image?,"['The image appears to be faded and damaged, with significant loss of detail and discoloration.']"
PPM2_155,"What artistic technique or style seems to be used, based on the description?","['Vignette', 'Fresco (or similar wall painting)']"
PPM2_155,What is depicted in the image?,"['A faded or deteriorated fresco or painting.', 'A scene possibly representing a cupid in flight with a thyrsus and cornucopia.', 'A figure that is difficult to discern clearly due to damage or age.']"
PPM2_155,What is the color mentioned in the description that might have been present in the original artwork?,['Yellow']
PPM2_155,What is the location of the image within the described context?,"['Cubicle (3), wall N, section E', 'Specifically within a described yellow middle area of the cubicle.']"
PPM2_155,What is the overall condition of the artwork shown in the image?,"['Damaged', 'Faded', 'Deteriorated', 'Difficult to interpret clearly']"
PPM2_155,What objects does the central figure seem to hold (based on the image and description)?,"['A thyrsus', 'A cornucopia']"
PPM2_229,Describe the wall's decoration.,"['Black plinth decoration, a black middle area with an illegible painting flanked by candelabra, and an upper white area with a triangular carpet border.']"
PPM2_229,What architectural feature is present on the wall?,['A window']
PPM2_229,What is depicted in the image?,"['A section of a wall from an ancient Roman building, specifically the peristyle (1), portico S, wall S, section W.', 'A wall with a window, showing remnants of painted decoration.']"
PPM2_229,What is the condition of the painting on the wall?,['Illegible; it was never documented.']
PPM2_229,What is the likely material of the wall?,"['It appears to be made of stone or brick, plastered and painted.']"
PPM2_229,What is the location of the depicted section within the building?,"['Peristyle (1), portico S, wall S, section W']"
PPM2_229,What is the purpose of the measuring device (the stick) visible in the image?,['To provide a scale reference for the size of the depicted section of the wall and the window.']
PPM2_237,"Based on the image and description, what style could this painting potentially belong to?","['It appears to be classical or Roman, given the use of classical motifs like cupids and garlands and based on the context of archaeological findings.']"
PPM2_237,What are the main elements of the described painting?,"['A red plinth, a yellow twisted candlestick, flying cupids, and an oblique garland.']"
PPM2_237,What colors are mentioned in the description of the wall painting?,"['Red, yellow, and white']"
PPM2_237,What is depicted in the image?,"[""A photograph of a room's wall with a painted fresco."", 'A black and white photo showing a section of a wall with faded painted decorations.']"
PPM2_237,What is the state of preservation of the wall painting?,"['The painting appears faded and partially damaged.', 'The painting is not fully intact; some details are difficult to discern.']"
PPM2_237,What type of architectural features are visible in the image besides the painted wall?,"['A brick wall, a wooden beam or support structure in the upper part of the image, and a small window or opening in the wall.']"
PPM2_300,What color was the carpet?,['Yellow']
PPM2_300,What does 'negative trace' mean in this context?,"['An imprint or stain left behind after the removal of an object.', 'The shape of the cupid is visible as a lighter or darker area on the wall because the object was removed']"
PPM2_300,What is the style of the cupid depicted?,['IV style']
PPM2_300,What is the surface that shows the cupid's impression?,['A wall']
PPM2_300,What part of the room is this wall located in?,"['Room (1), wall W, section N']"
PPM2_317,What is the significance of the figure's position and gaze?,"[""The figure's pose and gaze are described as inviting viewers into the room and encouraging them to examine the Dirce painting."", ""The figure acts as a visual guide or a symbolic 'invitation' to proceed into the room.""]"
PPM2_317,What is depicted in the image?,"['A winged figure, possibly a putto or Cupid, in flight.', 'A figure holding a situla (bucket) and a conical object.']"
PPM2_317,What is the artistic style of the image?,"['It appears to be a fresco painting.', 'The style suggests Roman art, possibly from a tomb or similar context.']"
PPM2_317,What is the figure holding in its hands?,"['A situla (bucket) in one hand and a conical object in the other.', 'A bucket-like container and what appears to be a lamp or similar object']"
PPM2_317,What is the likely purpose or context of this image based on the description?,"['Part of a larger decorative scheme in a Roman building, likely a tomb or house.', 'The image likely served a symbolic or ritualistic purpose within its original context.']"
PPM2_317,What other painting is  in relation to this image?,['The painting by Dirce.']
PPM2_576,What is depicted in the image?,"['A detail of a vignette showing a cupid in flight.', 'A cupid holding a club.']"
PPM2_576,What is the 'Wing (4)' referring to?,"['It likely refers to the fourth wing of a larger piece of art.  More context is needed for a definitive answer.', 'It could refer to a section or panel within a larger structure.']"
PPM2_576,What is the height of the cupid in the vignette?,['20 cm']
PPM2_576,What is the object the cupid is holding?,['A club']
PPM2_576,What is the style of the artwork?,['IV style']
PPM2_578,What is the artistic style of the image?,['IV style']
PPM2_578,Describe the overall condition or quality of the image. ,"['The image is grainy and somewhat indistinct, suggesting age or damage.', 'The quality is low, possibly due to the age of the original or the reproduction method.']"
PPM2_578,What does the cupid appear to be holding?,['A cornucopia']
PPM2_578,What is depicted in the image?,"['A detail of a vignette showing a cupid in flight with a cornucopia.', 'A flying cupid holding what appears to be a cornucopia.']"
PPM2_578,What is the location of the image within a larger context (based on the description)?,"['Wing (4), E wall, S section, Middle zone', ""It's part of a larger work, possibly a fresco or mural.""]"
PPM2_578,What type of artistic medium is likely involved?,"['Fresco', 'Mural', ""A painted surface of some kind, given the reference to a 'vignette' and 'wall'.""]"
PPM2_581,What is an acerra?,['An ancient Roman incense burner.']
PPM2_581,What is depicted in the image?,"['A detail of a vignette showing a cupid holding an acerra.', 'A figure, possibly Cupid, with an object that looks like an acerra.']"
PPM2_581,What is the condition of the artwork in the image?,"['It appears weathered or aged, showing some wear or damage.', 'The details are somewhat indistinct due to potential deterioration or the photographic quality.']"
PPM2_581,What is the height of the depicted cupid figure?,['20 cm']
PPM2_581,What is the overall tone or aesthetic of the image?,"['Dark, possibly due to age or the medium used.', 'Grainy, suggesting it might be a photograph of an older artifact.']"
PPM2_581,What is the style of the artwork?,['IV style (presumably referring to a Roman decorative style)']
PPM2_581,What zone of the wall is the vignette in?,['Middle zone']
PPM2_605,What is the location of this painting description?,"['Oecus verde (11), N wall, W section']"
PPM2_605,What characteristic of the small side paintings is noted in the description?,['Impressionism of the last third style']
PPM2_605,What color is characteristic of the walls in the described painting?,['Green']
PPM2_605,What elements in the painting are reminiscent of the III style?,"['The structure of the plinth', 'The median partition into fields divided by narrow bands', 'Profile portraits in full III style oval medallions (though not directly visible in the image)']"
PPM2_605,What is depicted in the central part of the image?,"['A black stripe with a vine shoot emerging from a kantharos (a type of ancient Greek drinking vessel) with snake-like handles.', 'Cupids in flight are shown along the vine branch.']"
PPM2_605,What is mentioned about the ornamental friezes above and below the central section?,['They are found in the late III style but are also widely attested in the IV style.']
PPM2_605,What is the proposed timeframe for the painting based on the description?,"['Neronian age', 'The description mentions a possible link to the Flavian age, but leans toward Neronian.']"
PPM2_605,What is the significance of the green color of the walls?,['It is typical of the transition phase between painting styles III and IV.']
PPM2_605,What is the style of the painting?,"['IV style', 'A transition phase between III and IV styles']"
PPM2_605,Who is cited as having an opinion on the stylistic period of the painting?,['II Beyen']
PPM2_606,Describe the condition of the fresco shown in the image.,"['The fresco is damaged; there are visible cracks and areas of loss.', 'Parts of the painting appear fragmented or deteriorated.']"
PPM2_606,What appears at the bottom of the depicted panel?,['A vase or urn']
PPM2_606,What colors are predominantly used in the fresco?,"['Greens and dark purples/browns.', 'A muted green background with darker accents.']"
PPM2_606,What is the artistic style of the painting?,"['It appears to be a Roman fresco, possibly from Pompeii or Herculaneum, based on the style and subject matter.', 'The style suggests a Roman wall painting from the classical period.']"
PPM2_606,What is the subject of the image?,"['A detail of a fresco depicting putti (cherubs) amongst grapevines.', 'A section of a wall painting showing a vertical panel with putti and vines.']"
PPM2_606,What mythological figures are depicted in the image?,['Putti (cherubs)']
PPM2_606,What type of plant is featured prominently in the image?,['Grapevines']
PPM2_608,Describe the central zone of the wall painting.,['Panels with squares separated by black stripes with vine leaves.']
PPM2_608,Describe the upper area of the wall painting.,['Green upper area with architectures.']
PPM2_608,What color is the central zone?,['Green']
PPM2_608,What elements flank the red frieze?,['Lotus and palmette friezes.']
PPM2_608,What is depicted in the central panel of the red plinth shown in the image?,['Crossed thyrsi with a hanging rhyton.']
PPM2_608,What is depicted in the red frieze?,['Centaurs and Lapiths.']
PPM2_608,What is depicted in the side panels of the red plinth?,['A griffin and garlands.']
PPM2_608,What is the style of the wall painting?,['IV style']
PPM2_608,What separates the panels on the red plinth?,['Narrow compartments with flowers.']
PPM2_608,What type of architectural feature is likely represented by the dark rectangular opening near the center of the image?,['A window or a niche']
PPM2_610,"What is the apparent subject of the painting, beyond the cupids?",['The decoration of a golden statue; implying a scene of preparation or ritual.']
