id,query,answers
PPM7_1384,What is the color of the plinth?,['Black with red squares.']
PPM7_1384,What is the overall condition of the depicted wall fragment?,"['Damaged and fragmentary.', 'Highly deteriorated, with significant loss of paint and structural integrity.', 'Preserves only a portion of the original artwork.']"
PPM7_1387,What architectural feature is mentioned in relation to the wall painting?,"['An aedicule (a small architectural recess or shrine), a lunette (a semicircular space above a door or window), and a vaulted ceiling.']"
PPM7_1387,What caused the damage to the west corner of the wall?,['A hole made by Pompeians who returned to the area after the eruption of Vesuvius in 79 AD.']
PPM7_1387,What color is the background of the lunette mentioned in the description?,['White']
PPM7_1387,What is depicted in the image?,"['A damaged section of a wall, possibly from an ancient Roman building, showing remnants of frescoes or painted decoration. The image is a black and white photograph of a wall in poor condition.  The details of the frescoes are largely indistinguishable in the provided image.']"
PPM7_1387,What is the condition of the wall depicted in the image?,['The wall is significantly damaged.  The description mentions a hole made by Pompeians and the image shows substantial deterioration of the painted surface.']
PPM7_1387,What is the context of the image?,"[""The image shows the south wall of an 'Oecus' (a type of Roman room).  Specifically, it depicts the section damaged by Pompeians after the eruption of Vesuvius in 79 AD.  The wall originally featured a tripartite structure, a painting of Atalanta and Meleager (now vanished), a seascape cartoon (also vanished), hanging masks, and depictions of cupids.""]"
PPM7_1387,What objects are the cupids depicted with?,['One cupid is depicted with an oinochoe (a type of wine jug) and a sacrificial knife. Another is shown with a hare and a green fruit.']
PPM7_1387,What significant elements of the original wall decoration are  but are no longer visible in the image?,"['The painting of Atalanta and Meleager, the seascape cartoon, the winged Nike (statue) above the aedicule, and cupids with various objects.']"
PPM7_1389,What condition is the wall in?,"['The wall is heavily damaged, showing cracks, missing plaster, and exposed stonework.']"
PPM7_1389,What is depicted in the central painting of the Oecus (c) wall W?,['The dressing table of Venus assisted by two cupids.']
PPM7_1389,What is depicted in the panel closest to the window of the Oecus (c) wall W?,['Another landscape with buildings and a peasant carrying a load and leaning on a stick.']
PPM7_1389,What is shown in the first panel on the left of the Oecus (c) wall W?,"['A landscape with buildings adorned with loggias and statues, a circular tower, a bridge with a man on horseback, and a servant.']"
PPM7_1389,What is the cupid in the second panel wearing?,['A red cloak.']
PPM7_1389,What is the overall subject of the vignettes on the Oecus (c) wall W?,"['Landscapes, figures (cupids, Venus, a man on horseback, a peasant), and scenes suggesting classical mythology or everyday life.']"
PPM7_1389,What materials appear to be present in the wall depicted in the image?,"['Plaster, stone, and possibly metal (from the visible wires or rods).']"
PPM7_1389,What object does the cupid in the second panel of the Oecus (c) wall W hold?,['A dead rooster.']
PPM7_156,What is depicted in the image?,"['A black and white photograph of a partially ruined wall with remnants of ancient decorations or frescoes.', 'A section of a wall from an ancient Roman building, showing stonework and faded wall paintings.']"
PPM7_156,What is the condition of the wall shown in the photograph?,"['Partially ruined, showing both preserved sections and areas of significant damage.']"
PPM7_156,What is the location of the wall shown in the image?,"[""It's the west wall of an 'Oecus' (a type of Roman room).""]"
PPM7_156,What is the significance of the wall's decoration?,"['The wall decoration is well-preserved and has been documented by several artists and researchers, including Zahn, Niccolini, and Boulanger.']"
PPM7_156,What kind of image is it?,['A black and white photograph']
PPM7_156,What type of material seems to be used for the wall?,"['Stone, judging from the appearance of the visible parts of the structure.']"
PPM7_1665,"Based on the image, what can you infer about the painting technique?","['It appears to be a fresco or a similar wall painting technique.', 'The paint seems to have been applied directly onto the wall surface.']"
PPM7_1665,What is a triclinium?,"['A dining room in a Roman house.', 'A Roman dining area.']"
PPM7_1665,What is depicted in the image?,"['A vignette of a cupid in flight.', 'A flying cupid.']"
PPM7_1665,What is the condition of the artwork shown in the image?,"['Fragmented or damaged', 'The artwork shows significant damage and loss of paint.']"
PPM7_1665,What is the style of the artwork?,['IV style']
PPM7_1666,"Based on the image, what can be inferred about the original artwork?","['It was likely a colourful painting, judging from the remaining traces.', 'The cupid was probably depicted in motion.']"
PPM7_1666,What is depicted in the image?,"['A vignette of a cupid in flight.', 'A partially preserved painting of a cupid.']"
PPM7_1666,What is the condition of the image?,"['Partially preserved', 'Damaged', 'Shows signs of age and deterioration', 'Difficult to discern the complete details']"
PPM7_1666,What might be the significance of the location (triclinium) of the artwork?,"['Triclinia were dining rooms in Roman houses, suggesting the artwork was for the enjoyment of the diners.', 'The artwork might have been part of a larger decorative scheme within the room.']"
PPM7_1666,What type of artistic style might the image represent?,"['Vignette', 'Possibly Roman fresco painting given the context of a triclinium']"
PPM7_1668,"What is the location of this artwork, as indicated by the description?","['Triclinium (25), E wall, N section']"
PPM7_1668,What is a patera?,"['A shallow, usually round, dish used in ancient times, often for offerings.']"
PPM7_1668,What is a Triclinium?,['A Roman dining room.']
PPM7_1668,What is depicted in the image?,"['A vignette of a cupid in flight holding a patera with offerings.', 'A flying cupid with a shallow bowl or dish (patera).']"
PPM7_1668,What is the artistic medium of the depicted artwork?,"['The image quality is too poor to state with certainty. However given the context, it may be a fresco or a painting on a wall.']"
PPM7_1668,What is the overall condition of the artwork as shown in the image?,['The image appears faded and somewhat damaged; details are not easily discernible.']
PPM7_1668,What is the style of the artwork depicted in the image?,['IV style']
PPM7_1668,What kind of offerings might the cupid be carrying?,"[""Fruits, flowers, wine, incense.  (These are common ancient offerings, but the image doesn't specify.)""]"
PPM7_1669,Describe the condition of the artwork based on the image.,"['The artwork appears to be damaged or faded, with a mottled or textured appearance.', 'The image is unclear and shows significant deterioration.']"
PPM7_1669,What can be inferred about the age of the artwork?,"['The artwork appears to be ancient, considering its description and condition.', ""The 'IV style' designation suggests a specific historical period.""]"
PPM7_1669,What is depicted in the image?,"['A vignette of a cupid in flight carrying a tray with offerings.', 'A flying cupid with a tray.']"
PPM7_1669,What is the cupid carrying?,['A tray with offerings']
PPM7_1669,What is the overall color scheme of the artwork?,"['The image is primarily in shades of gray, suggesting a monochrome or faded palette.']"
PPM7_1669,What is the style of the artwork?,['IV style']
PPM7_1670,"Based on the image, what is the condition of the artwork?","['Worn or faded', 'The artwork shows significant signs of age and deterioration.', 'The details are indistinct and difficult to discern clearly.']"
PPM7_1670,What are some possible interpretations of the 'vignette' term in this context?,"['A small, decorative scene within a larger work or setting.', 'A smaller, self-contained artwork within a bigger area.', 'A scene that provides a visual focus within its location.']"
PPM7_1670,What is depicted in the image?,"['A vignette of a cupid.', 'A faded or worn image of a figure that appears to be a cupid.', 'A faint outline of a child-like figure resembling a cupid.']"
PPM7_1670,What is the style of the artwork shown in the image?,['IV style']
PPM7_1670,What type of surface does the cupid appear to be painted on?,"['A wall surface, likely plaster or stone', 'A textured surface']"
PPM7_1673,What is a triclinium?,['A dining room in a Roman house.']
PPM7_1673,What is depicted in the image?,"['A cupid (or possibly a putto)', 'A vignette of a winged figure', 'A figure that appears to be dancing or gesturing']"
PPM7_1673,What is the significance of the better state of conservation of this vignette?,"['It allows for assessment of the overall quality of the Fourth Style decoration in the room.', 'It provides a benchmark for comparison with other, less well-preserved parts of the decoration.']"
PPM7_1673,What is the style of the artwork in the image?,"['Fourth Style Roman wall painting', 'Low-quality Fourth Style decoration (based on the text)']"
PPM7_1674,"Based on the image, describe the visual style of the cupid.","['The cupid is depicted in a somewhat stylized manner, potentially showing movement.', 'The image is dark and shows a high contrast between light and dark areas.', 'The lines and forms suggest a classical influence.']"
PPM7_1674,What is depicted in the image?,"['A vignette of a cupid.', 'A partial depiction of a cupid, seemingly damaged or incomplete.', 'A fragment of a wall painting showing a cupid.']"
PPM7_1674,What is the condition of the artwork in the image?,"['Damaged or fragmented.', 'Incomplete, showing signs of deterioration or breakage.', 'Only a portion of the original artwork is visible.']"
PPM7_1674,What is the style of the artwork?,['IV style (likely referring to a Roman painting style)']
PPM7_1674,What medium is the artwork likely executed in?,"['Fresco (common in Roman wall paintings)', 'Some type of paint on plaster']"
PPM7_1677,What does the description suggest about the overall style or theme of the room?,"['It might have Dionysian or Bacchic themes', 'It could be decorated with other mythological elements']"
PPM7_1677,What is depicted in the image?,"['A cupid (or Eros)', 'A winged figure', 'A vignette of a cupid']"
PPM7_1677,What is the condition of the image?,"['It appears somewhat damaged or worn', 'There are signs of cracking or deterioration in the surface']"
PPM7_1677,What is the image's context?,"[""It's a vignette from a triclinium (dining room)"", ""It's located on the wall (south to east) of a door in room 22"", ""It's part of a larger mosaic or wall painting""]"
PPM7_1677,What is the relative location of the image within the room?,['On the south wall to the east of the door of room 22']
PPM7_1677,What is the style of the cupid's depiction?,"['Somewhat naturalistic, but also stylized', 'The features are not highly realistic, rather suggestive']"
PPM7_1679,What does 'vignette' mean in the context of this description?,"['A small decorative illustration or scene, often placed in a corner or border.', 'A small, self-contained image within a larger context.', 'It indicates that the Cupid image is a smaller picture within a larger decorative scheme of the room.']"
PPM7_1679,What is depicted in the image?,"['A vignette of Cupid in flight carrying a cornucopia.', 'A painting of a winged figure (Cupid) with a cornucopia.']"
PPM7_1679,What is the condition of the artwork shown in the image?,"['It appears to be damaged or fragmented.', 'The image shows signs of age and deterioration, possibly due to damage or the passage of time.']"
PPM7_1679,What is the significance of the cornucopia held by Cupid?,"['It symbolizes abundance and prosperity.', ""It's a common attribute of Cupid and suggests themes of bounty and generosity.""]"
PPM7_1679,What is the style of the artwork?,['IV style']
PPM7_1680,What is a 'pedum'?,"[""A shepherd's crook or staff.  Further research would be needed to be definitive based on the image alone.""]"
PPM7_1680,What is depicted in the image?,"['A vignette of a cupid holding a pedum.', 'A partially preserved fresco of a cupid.']"
PPM7_1680,What is the condition of the artwork?,"['Partially preserved or damaged', 'The image shows significant damage and loss of paint.']"
PPM7_1680,What style is the artwork identified as?,['IV style']
PPM7_1680,What type of room is a triclinium?,['A dining room in a Roman house.']
PPM7_182,"Based on the image and the description, what can we infer about the subject matter?",['It is likely an archaeological record documenting the condition of a historical wall.']
PPM7_182,What could the dark horizontal line across the middle of the image represent?,"['A crack in the wall', 'A different type of material used in construction', ""A shadow or a feature of the wall's structure""]"
PPM7_182,What is 'Esedra (y)'?,"['Likely an archaeological site or location.', 'A specific area or structure within a larger site.']"
PPM7_182,What is depicted in the image?,"[""An aerial or close-up view of a wall (labeled 'wall W') in a site called 'Esedra (y)'"", 'The current state of a section of wall W at the Esedra (y) site.', 'A photograph showing the condition of wall W at Esedra (y).']"
PPM7_182,What kind of photographic technique appears to have been used?,"['Black and white photography', 'Possibly an aerial photograph (if the image shows a large area), or a very close-up ground photo.']"
PPM7_182,What seems to be the state of the wall shown in the image?,"['Damaged or deteriorated', 'Partially destroyed or eroded', 'Shows signs of age and weathering']"
PPM7_1842,What are the different decorative periods ?,"['A period with a leather threshold.', 'A period with a IV style decoration (yellow plinth and black median area with a cupid vignette).']"
PPM7_1842,What is depicted in the image?,"['A black and white photograph of a section of a wall, possibly from an archaeological site.', 'A close-up of a damaged wall section showing infill material and what appears to be remnants of past wall decoration.']"
PPM7_1842,What is the 'IV style' referring to?,"['A specific style of wall decoration prevalent in a certain historical period (likely Roman, given the context).', 'The description suggests a style characterized by a yellow plinth and a black median area with a central vignette.']"
PPM7_1842,What is the significance of the 'infill' ?,"['It represents a layer of material added to the wall at a specific time, indicating a phase of construction or repair.', ""Its position between the leather threshold and the IV style decoration suggests it marks a chronological phase in the building's history.""]"
PPM7_1842,What is the significance of the cupid vignette mentioned in the description?,"['It is a decorative element within the IV style wall painting.', 'It provides further information about the artistic style and potential date of the decoration.']"
PPM7_1842,What kind of material is likely to be the infill?,"['This cannot be determined from the image or the text alone. It could be rubble, mortar, brick, or other building materials.']"
PPM7_1855,How are the cupids discernible in the image?,"['Only through sketches engraved in the plaster', 'Faint outlines or traces of the original artwork']"
PPM7_1855,What figures are faintly visible in the central panels?,['Cupids']
PPM7_1855,What is depicted in the image?,"['A photograph of a wall in an Oecus (room 44), showing remnants of fourth-style Roman wall decoration.', 'A black and white image of a wall with faded or damaged frescoes or paintings.', 'A monochrome background with partially visible vignettes featuring cupids.']"
PPM7_1855,What is the condition of the wall decoration shown?,"['Damaged', 'Faded', 'Partially preserved', 'Only faintly visible sketches remain.']"
PPM7_1855,What is the predominant color of the wall's background?,"['Black', 'Monochrome black']"
PPM7_1855,What is the wall's orientation?,['Wall E']
PPM7_1855,What style of Roman wall decoration is represented?,['Fourth-style decoration']
PPM7_1855,What type of room is the Oecus?,['A formal reception room in a Roman house']
PPM7_1890,What are the prominent colors in the painting?,"['Black', 'Red']"
PPM7_1890,What elements are visible in the middle zone of the painting?,"['Panels alternating with compartments showing complex plant candelabra', 'An illegible central picture', 'Vignettes with pairs of cupids on the sides']"
PPM7_1890,What elements are visible in the upper zone of the painting?,"['Flying figures within aedicules', 'Small pictures depicting still life', 'An offerer on a tall tripod in the center']"
PPM7_1890,What is depicted in the image?,"['A wall painting from an Oecus (room 48), specifically wall E.', 'A section of a wall showing a black plinth, panels, and a red upper zone.', 'A wall painting in the IV style, showing various scenes including cupids, plant candelabra, flying figures within aedicules, still life, and an offerer on a tripod.']"
PPM7_1890,What is the nature of the lower part of the wall?,['A black plinth']
PPM7_1890,What is the overall condition of the painting?,['The painting appears damaged and faded in places.']
PPM7_1890,What is the room depicted in the image called?,['Oecus']
PPM7_1890,What is the style of the wall painting?,['IV style']
PPM7_1891,Describe the appearance of the cupids in the image.,"['They appear to be winged, youthful figures in flight.', 'Their features are somewhat indistinct, but they seem to be holding a shield between them.']"
PPM7_1891,What color is the panel on which the cupids are depicted?,['red']
PPM7_1891,What is depicted in the image?,"['A vignette of a pair of cupids in flight holding the shield of Ares.', 'Two winged cupids holding a shield.']"
PPM7_1891,What is the overall tone or mood of the image?,"['Dark and somewhat somber due to the monochrome presentation and the worn appearance of the subject matter.', 'Mysterious and antique']"
PPM7_1891,What is the significance of the shield held by the cupids?,"['It is the shield of Ares (the Greek god of war).', 'It suggests a connection to war or conflict.']"
PPM7_1891,What is the style of the artwork depicted in the image?,['IV style']
PPM7_1903,Describe the color scheme of the fresco.,"['Black plinth, alternating panels and compartments, red middle and upper areas.  The upper area features newsstands with paintings and figures.']"
PPM7_1903,How does the wall decoration relate to the existing openings in the room?,"['The wall decoration does not take into account the existing openings, as in neighboring rooms.']"
PPM7_1903,What architectural feature is visible in the image?,['A window with a marble sill opening onto a terrace (56)']
PPM7_1903,What is the significance of the 'newsstands' mentioned in the description?,"['They are likely decorative elements within the fresco, possibly depicting scenes or figures within framed areas resembling newsstands.']"
PPM7_1903,What is the style of the fresco on the wall?,['IV style fresco']
PPM7_1903,What material is the wall predominantly constructed from (visible in the image)?,"['Stone (likely volcanic rock, given the context of Pompeii)']"
PPM7_1903,What room is depicted in the image?,['Oecus (48)']
PPM7_1903,Which wall of the Oecus is shown?,['South wall (S wall)']
PPM7_220,What artistic style does the image likely represent?,"[""It's likely a Roman fresco, given the mythological subject matter."", 'It seems to be in a classical style.']"
PPM7_220,What creatures surround the Triton?,['Dolphins and cupids.']
PPM7_220,What is depicted in the image?,"['A detail of a fresco showing a Triton holding a kantharos upside down on his left shoulder and swimming, surrounded by dolphins and cupids.', 'A section of a wall painting showing a mythological scene with Triton, dolphins, and cupids.']"
PPM7_220,What is the location of the Triton in the scene?,['He is swimming towards the bottom of the wall.']
PPM7_220,What is the object held by the Triton?,['An upside-down kantharos.']
PPM7_220,What is the overall condition of the fresco fragment shown in the image?,"['The fresco appears damaged and fragmented.  The details are somewhat worn or obscured.', 'The image shows a deteriorated section of the fresco.']"
PPM7_220,What is the setting of the depicted scene?,"['An apodyterium (B), specifically the lunette S, in the western section of the wall.']"
PPM7_235,"What is a lacunar, based on the context of the description?","['A recessed decorative panel in a ceiling or vault, often with individual designs or compartments.']"
PPM7_235,What is the location of the depicted section of the vault's metadata?,"['Tepidarium (D), vault, SE section']"
PPM7_235,What is the style of the decoration in the image?,"['Typical of the Neronian-Flavian age, characterized by redundancy of figures, colorful filling of spaces, and strong projection of figurative parts.', 'A combination of large rectangular and square lacunars with medallions, standing figures, and combinations of squares and octagons.']"
PPM7_235,What colors are mentioned in the description of the vault's decoration?,"['Red, dark blue, light blue, white']"
PPM7_235,What figures are specifically mentioned in the description as being present in the decoration?,"['Eros (with a bow), Ganymede (abducted by an eagle), cupids, griffins']"
PPM7_235,What geometric shapes are prominent in the vault's decoration?,"['Rectangles, squares, octagons, lozenges, triangles']"
PPM7_235,What is depicted in the image?,"['A black and white photograph of a section of a decorated vault, showing intricate carvings and reliefs.', ""A fragment of a Roman tepidarium's vault showing decorative elements including figures, medallions, and geometric patterns.""]"
PPM7_235,What is the condition of the depicted section of the vault?,"['Partially damaged or fragmented; some areas are missing, indicated by rough edges and missing sections in the image.']"
PPM7_277,What animals are depicted in the hunting scene?,"['A deer', 'A dog', 'A hare']"
PPM7_277,What is depicted in the image?,"['A predella with hunting cupids.', 'A scene showing cupids hunting animals.', 'Two cupids hunting a deer, a dog, and a hare.']"
PPM7_277,What is the condition of the deer in the image?,['Wounded']
PPM7_277,What is the deer doing in the image?,['Fleeing to the right']
PPM7_277,What is the location of the predella ?,"['Cubicle (8), N wall']"
PPM7_277,What is the overall color scheme of the image?,['Dark background with lighter figures of cupids and animals.']
PPM7_277,What is the second cupid doing in the image?,"['Raising his hands in response to a cry.', 'Looking down at a hare.']"
PPM7_277,What weapons are the cupids depicted as using?,"['Skewers', 'Spits']"
PPM7_39,What is the location of this image?,"['Room (10), wall E, median area; side panel S']"
PPM7_39,Describe the condition of the image.,['The image is fragmented and damaged; parts of the fresco appear to be missing or deteriorated.']
PPM7_39,What is depicted in the image?,"['A flying figure of winged Victory.', 'A winged figure holding a trophy.', 'An angel-like figure with wings and a garment.']"
PPM7_39,What is the artistic style or period suggested by the image?,"['Ancient (likely Roman or Greek, given the chiton and depiction of Victory), Fresco']"
PPM7_39,What is the figure holding?,['A trophy.']
PPM7_39,What is the figure wearing?,['A chiton (a type of ancient Greek tunic).']
PPM7_39,What might the trophy represent?,"['A symbol of victory in battle or competition', 'A symbol of triumph or success']"
PPM7_391,What is depicted in the image?,"['Fresco remains from room III and a masonry base against the north wall.', 'Remnants of a fresco painting on a wall, showing significant damage and deterioration.', 'A section of a wall with visible layers of plaster and paint, indicating past decoration.']"
PPM7_391,What is the condition of the fresco?,"['The fresco is heavily damaged and fragmented.', 'Only remains of the fresco are visible; much of it is lost.', 'The fresco shows significant deterioration, with large parts missing.']"
PPM7_391,What kind of material is the wall made of?,"['The image suggests the wall might be made of stone or brick, given the visible texture.', 'More information is needed to confirm the specific composition of the wall material.']"
PPM7_43,"Based on the image, what can be inferred about the artistic skill of the creator?","['Difficult to assess definitively from the provided grayscale image, but the depiction suggests a degree of skill in portraying movement and conveying the figures.', 'The detail level appears limited, possibly due to degradation of the original artwork.']"
PPM7_43,What is depicted in the image?,"['A flying figure identified as Vesper, wearing a short purple chiton and leather boots, with Diana-Luna seated on his wings holding a burning torch.']"
PPM7_43,What is Diana-Luna holding?,['A burning torch']
PPM7_43,What is the image's location within the site?,"['Room (10), wall W, lateral panel N']"
PPM7_43,What is the overall condition of the artwork depicted in the image?,['The image quality suggests some damage or deterioration of the original artwork. It is difficult to assess the level of detail due to image resolution and possible deterioration of the original.']
