id,query,answers
image52937,"Based on the composition and figures, what might be a possible interpretation of the painting's meaning?","['The painting could symbolize the triumph of reason and heroism (Theseus) over savagery and chaos (Minotaur), with Ariadne as a crucial facilitator.', 'The scene might also suggest a reflection on the consequences of violence and the emotional toll of such an event on those involved.', 'It could be a commentary on the nature of victory, exploring themes of power, compassion, and the potential for both triumph and loss.']"
image52937,Describe the composition of the figures in the painting.,"['The composition features three figures: Theseus, Ariadne, and the Minotaur. Theseus is seated, Ariadne stands, and the Minotaur lies prostrate.  They are arranged in a triangular formation.', ""The figures are positioned in a way that creates a visual tension between Theseus's relaxed posture and the subdued state of the Minotaur and Ariadne's apparent contemplation."", 'The placement of the figures suggests a narrative sequence or moment of reflection following a significant event.']"
image52937,How does the setting contribute to the overall composition?,"['The simple architectural setting  a corner with a wall and a possible doorway  provides a neutral backdrop that focuses attention on the figures. ', 'The architectural elements create depth and suggest an interior space, furthering the narrative context.']"
image52937,How is the narrative of Theseus and Ariadne represented in the painting?,"[""The painting shows the aftermath of Theseus's victory over the Minotaur.  Ariadne's presence suggests her role in helping Theseus navigate the labyrinth."", ""The painting may be showing a moment of contemplation following Theseus's successful escape from the labyrinth.""]"
image52937,What is the subject matter of the painting?,"['The painting depicts a scene from the myth of Theseus and the Minotaur, showing Theseus, Ariadne, and the defeated Minotaur.']"
image52937,What seems to be the emotional state or mood conveyed by the figures?,"['Ariadne appears pensive or concerned.  Theseus appears calm or perhaps triumphant, but not overtly celebratory.', ""The Minotaur's prostrate position indicates defeat and suffering."", 'The overall mood is one of post-conflict reflection or quiet resolution.']"
image52943,How many cupids are depicted in the painting?,"['At least seven, possibly more depending on interpretation of partially obscured figures.']"
image52943,What is depicted in the image?,"['A wall painting copy of Venus with fishing cupids.', 'A scene of cherubs or cupids fishing in a boat and from rocks near the shore, with a sail boat in the background.']"
image52943,What is the medium of the image provided?,"['It appears to be a reproduction of a painting, possibly a photograph or a printed copy of a drawing.']"
image52943,What is the overall tone or style of the painting?,"['Lighthearted and playful, characteristic of depictions of cupids.', 'Possibly classical or neoclassical in style, given its subject matter and Pompeii origin.']"
image52943,What is the significance of the 'Venus' mentioned in the description?,"['It likely refers to the mythological goddess Venus, possibly implied by the presence of the cupids, who are often associated with her.', 'It may suggest a broader scene, with Venus perhaps observing the cupids from a hidden vantage point, though not explicitly shown.']"
image52967,"Who is the figure of the child in the doorway, and what is its role?","['It is a cupid, guiding the narrative by pointing towards Helen, possibly indicating her as the prize.', ""A cupid, directing the viewer's attention to Helen.""]"
image52967,What is depicted in the wall painting?,"['A seated figure of Paris awaiting the prize promised by Aphrodite.', 'Paris waiting for Helen, with a cupid pointing towards her. ', 'A scene showing Paris, a cupid, and Helen (presumably).']"
image52967,What is the artistic style of the painting?,"['The image suggests a Roman fresco style, common in Pompeii.', 'A style typical of Roman wall paintings from Pompeii.']"
image52967,What is the significance of the figure of Paris in the painting?,"[""He's awaiting the prize (Helen) promised to him by Aphrodite in the Judgement of Paris story."", 'He is the central figure of the narrative represented.']"
image52967,What type of room was the painting found in?,['A cubiculum (bedroom)']
image52984,What colors are visible in the remaining painted plaster?,"['Off-white or light beige', 'Pink or reddish', 'Possibly traces of other colors (difficult to determine from image)']"
image52984,What is shown in the image?,"['Remains of painted plaster', 'A section of a wall with painted plaster', 'Damaged painted plaster in a corner of a room', 'Cracked and deteriorated painted plaster']"
image52984,What is the condition of the painted plaster?,"['Damaged', 'Cracked', 'Deteriorated', 'Partially preserved']"
image52984,What is the significance of the image?,"['It documents the archaeological remains of Pompeii', 'It shows the state of preservation of painted plaster in a Pompeian building', 'It provides visual evidence of Roman painting techniques']"
image52984,What kind of material seems to be visible next to the painted plaster?,"['Stone or brick', 'Possible mosaic fragments']"
image52987,Describe the color scheme of the alcove's wall paintings.,"['Yellow zoccolo (baseboard) with painted plants, violet panels in the middle zone bordered, and a vignette of a cupid in the center.']"
image52987,What is a notable feature of the alcove's floor?,['It was raised.']
image52987,What is the purpose of the opening visible at the top of the alcove's structure?,['Potentially a ventilation shaft or a chimney.  More context is needed for a definitive answer.']
image52987,What is the state of preservation of the alcove?,['Partially ruined or damaged; significant portions of the walls and ceiling are missing.']
image52987,What is visible in the center of the wall painting?,['A vignette of a cupid']
image52987,What kind of architectural detail is suggested by the structure's curved top?,['Possibly a vaulted ceiling or a niche with an arched top']
image52987,What materials appear to make up the structure's remains?,['Stone or brick rubble and plaster']
image52987,What type of structure is depicted in the image?,"['A small room, alcove, or possibly a niche within a larger structure']"
image53087,"What objects are depicted in the painting, and what is their significance?","['Ariadne is holding out a ball of thread to Theseus. This ball of thread is a key object from the myth and represents the tool that helps Theseus navigate the Labyrinth.', ""Theseus carries a staff or spear, potentially symbolizing his role as a hero or warrior.  The staff's presence also suggests the Labyrinth's challenging nature."", 'The architectural setting suggests an indoor space, likely representing a scene within the palace on Crete.']"
image53087,Describe the composition of the figures in the painting. How are Ariadne and Theseus positioned in relation to each other?,"['Ariadne is seated on a bench or throne, while Theseus stands.  They are positioned facing each other, engaged in a direct interaction.', ""The figures are arranged in a relatively balanced composition, with Ariadne's seated position providing a visual counterpoint to Theseus's standing posture.""]"
image53087,How are the characters depicted visually? What might this say about their roles in the story?,"['Ariadne is clothed in a flowing garment, suggesting her regal status or feminine grace.  Theseus, while somewhat damaged, presents a more physically powerful appearance in his nude form, implying his strength and heroism.', ""The damage to Theseus's body might be interpreted as representing the hardships he has faced within the Labyrinth, highlighting the dangerous undertaking he has undergone.""]"
image53087,What is the implied narrative moment depicted in the artwork?,['The painting depicts the moment when Ariadne gives Theseus the crucial ball of thread that will allow him to escape from the Labyrinth after defeating the Minotaur.']
image53087,What is the overall mood or atmosphere conveyed by the painting?,"['The painting projects a relatively calm and focused atmosphere, suggesting a moment of crucial exchange and collaboration between the two figures rather than overt drama or violence.', ""The interaction between Ariadne and Theseus suggests a sense of trust and cooperation, emphasizing Ariadne's pivotal role in enabling Theseus's escape.""]"
image53089,"Based on the image, what appears to be the style of the artwork?","['Classical', 'Possibly Roman or Greco-Roman']"
image53089,What is depicted in the wall painting?,"['Ares and Aphrodite (or Mars and Venus), surrounded by cupids.']"
image53089,What is the URL provided for further information?,['http://arachne.uni-koeln.de/item/marbilder/5343207']
image53089,What mythological figures are prominently featured in the center of the painting?,"['Ares and Aphrodite (the Greek names)', 'Mars and Venus (the Roman names)']"
image53089,What other elements are present in the background of the painting?,"['Landscape elements', 'Possibly trees and rocks']"
image53089,What smaller figures surround the central figures?,['Cupids']
image53129,"Considering the image description, what myth is this painting likely depicting?",['The painting likely depicts a scene from the myth of Theseus and the Minotaur.  The presence of Theseus with his club hints at his victory or a moment immediately following it.']
image53129,Describe the composition of the painting. How are the figures arranged in the space?,"['The painting features a central figure, Theseus, seated prominently. He is positioned slightly off-center, creating a dynamic visual balance. A second, smaller figure is visible in the background, depicted in profile.', ""The figures are arranged in a hierarchical manner, with Theseus occupying the most visual weight. The background figure is less detailed and serves as a supporting element to Theseus's pose and importance.""]"
image53129,What elements in the painting contribute to a sense of depth or space?,"['The use of overlapping figures helps to create a sense of depth. The placement of the background figure behind Theseus establishes a visual hierarchy and spatial separation.', 'The variation in color intensity and detail between Theseus and the background figure could be interpreted to create depth. The background appears less sharply defined and lighter than Theseus.']"
image53129,What is the overall mood or feeling conveyed by the painting?,"[""The painting projects a sense of calm strength and perhaps quiet triumph.  This is conveyed through Theseus's relaxed yet assertive pose. The muted color palette contributes to a sense of tranquility."", 'The painting might also convey a narrative implication, hinting at a moment of reflection or post-conflict calm.']"
image53129,What is the relationship between Theseus and the figure in the background?,"['The relationship is unclear from the image alone. The background figure could be a witness, an attendant, or another character from the myth.', 'The relative size and placement suggest a subordinate role for the background figure in relation to Theseus.']"
image53129,What is the significance of the club in Theseus's hand?,"[""The club signifies Theseus's role as a hero and his association with strength and power. It may allude to his victory over the Minotaur.""]"
image53129,What is Theseus's posture and what object is he holding?,['Theseus is seated with a relaxed yet dignified posture. He holds a club in his right hand.']
image53133,Describe the setting or background of the painting.,"['A landscape with trees, rocks, and a possibly mountainous background.', 'A bucolic or pastoral setting suggesting an idyllic natural scene.']"
image53133,What colors are predominantly used in the painting?,"['Reds, browns, and muted earth tones.', 'The colors are mostly subdued and earthy.']"
image53133,What is depicted in the wall painting?,"['Hercules lying down with cupids.', 'A reclining figure (Hercules) with one or more cupids.']"
image53133,What is the condition of the painting?,"['The painting shows signs of age and damage; some areas appear faded or deteriorated.', 'The paint appears to be somewhat worn and faded in places.']"
image53133,What is the style of the painting?,"['It appears to be a Roman fresco painting, likely in the style typical of Pompeii.', 'The style is suggestive of Roman wall painting from the ancient city of Pompeii, characterized by its relatively muted colors and classical subject matter.']"
image53225,Describe the compositional arrangement of the figures in the painting.,"[""The composition is divided into two main sections: one featuring Theseus' departure and the other showing Pallas Athena on a cliff. Theseus and a sailor are centrally located, interacting near a ladder serving as a bridge to a ship.  Athena appears in the upper left, separated from the main scene. Ariadne is implied to be present but destroyed. ""]"
image53225,Describe the figure of Athena and her placement in the composition. What might her presence signify?,"[""Athena, armed with a helmet, shield, and spear, is positioned on a cliff in the background. Her presence may symbolize divine judgment, observation of Theseus' actions, or a contrasting moral force.""]"
image53225,How does the state of preservation of the painting affect its interpretation?,"[""The poor condition of the painting, particularly the destruction of Ariadne's figure, impacts our understanding of the full narrative and the artist's original composition and intent. The missing figure of Ariadne leaves a gap in the visual telling of the story.""]"
image53225,What elements of the painting suggest a maritime setting?,"[""The ship's prow, the sailor assisting Theseus, and the implied sea around the ship are all visual elements that establish the scene as taking place at a port or seaside.""]"
image53225,What is the emotional tone conveyed by the depiction of Theseus' departure?,"[""The scene likely portrays a sense of coldness and betrayal; the focus on Theseus's somewhat nonchalant ascent to the ship, without any emotional interaction, suggests a lack of remorse for his actions.""]"
image53225,What is the primary narrative depicted in the main section of the painting?,"[""The central narrative focuses on Theseus abandoning Ariadne.  This is shown through Theseus' interaction with a sailor as he boards a ship, leaving Ariadne behind.""]"
image53225,What role does the ladder play in the composition and the narrative?,"[""The ladder acts as a bridge from the shore to the ship, symbolizing Theseus' escape and abandonment of Ariadne. It is a key element linking the action of his departure and the ship, which is crucial to the narrative.""]"
image5689,What is the approximate diameter of the painted medallions mentioned in Mau's description?,['0.27 meters']
image5689,What is the background color of the wall paintings mentioned?,['White']
image5689,What is the direction the photograph is taken?,['Southeast']
image5689,What is the location depicted in the image?,"['Pompeii', 'The atrium of a house in Pompeii', ""A doorway in the south wall of the oecus 'c' in Pompeii""]"
image5689,What is visible in the image?,"['Ruins of a wall', 'Part of an atrium', 'Vegetation', 'A gap or doorway in the wall', 'A glimpse of another structure in the background']"
image5689,What painting style is mentioned in the description of the oecus walls?,['IV style']
image57404,What elements of decoration are visible in the watercolor?,"['Friezes with floral motifs and figures.', 'A band with running animals.', 'A lower section with architectural details and a possible curtain or drape.', 'Different colors such as red, yellow, and teal.']"
image57404,What is depicted in the watercolor?,"['A section of the decoration from the east wall of a cubiculum in Pompeii.', 'A detailed rendering of wall paintings, showing friezes, figures, and color schemes.']"
image57404,What kind of room is a 'cubiculum'?,"['A bedroom or small private room in a Roman house.', 'A sleeping chamber.']"
image5770,What is depicted in the image?,"['An aedicula lararium, a small shrine.', 'A niche in a garden area.', 'A Roman-era architectural feature.']"
image5770,What is the architectural style of the aedicula?,"['It features a pediment, pilasters, and an arched opening.', ""It's consistent with Roman architectural styles.""]"
image5770,What is the purpose of an aedicula lararium?,"['It served as a household shrine for the Lares, household gods in Roman religion.', 'It was a place for offerings and worship.']"
image5770,What is the state of preservation of the aedicula?,"['It shows signs of age and weathering.', 'Some stucco and paint is missing.', ""It's a ruin, but features are still visible.""]"
image5770,What is visible inside the aedicula?,"['A small, low platform or base.']"
image5770,What material was used to coat the interior of the niche?,['Yellow stucco']
image5770,What was painted on the interior of the niche?,['A leafy tree with birds flying around it']
image57790,"Based on the description and image, what is a plausible interpretation of the scene?","['A depiction of mythological figures, possibly Psyche and Cupid, in flight.', 'A representation of winged cherubs or angels.']"
image57790,What is depicted in the image?,"['Two flying figures, possibly Psyche and Cupid.', 'Two winged figures, one seemingly draped in clothing and the other appearing nude.', 'Pencil sketches of two cherubic figures with wings.']"
image57790,What is the condition of the original wall decoration mentioned in the description?,['It has faded away.']
image57790,What kind of image is provided?,"['A drawing or sketch.', 'A pencil sketch.', 'A reproduction of a drawing.']"
image58002,"What is the overall color scheme of the painting, as seen in the image?",['Primarily reddish-brown tones']
image58002,On which wall of the atrium was this painting located?,['East wall']
image58002,What animals are pulling the cart in the painting?,['Panthers']
image58002,What appears to be the occupation or role of the figure guiding the cart?,"['Cupid', 'Charioteer']"
image58002,What is depicted in the provided image?,"['A detail of a painting showing panthers pulling a cart guided by a cupid.', 'A scene featuring panthers harnessed to a chariot driven by a winged figure (likely Cupid).']"
image58002,What is the condition of the painting based on the image?,['The painting is fragmented and damaged. Some parts are missing.']
image58019,Describe the style of the cupid depiction.,"['The style appears somewhat faded and possibly ancient.', 'The style is simple, focusing on the essential shape and form of the flying cupid.', 'It appears to be a fresco style painting']"
image58019,What color is the background of the painting?,"['A reddish-brown or terracotta color.', 'A muted orange-brown tone.']"
image58019,What is depicted in the image?,"['A painted flying cupid.', 'A painting of a winged figure, likely a cupid, in flight.']"
image58019,What is the likely context of the image? ,"[""It's an archaeological find from Pompeii."", ""It's a photograph of a painted fresco in a Pompeiian building."", 'It documents a piece of Roman art.']"
image58022,Describe the color palette of the fresco.,"['Earthy tones, predominantly browns, tans, and reds.  Some hints of other colors, but heavily faded.']"
image58022,What is an 'oecus'?,['A large reception room in a Roman house.']
image58022,What is the condition of the fresco?,"['Damaged, showing signs of age and deterioration, including cracks and discoloration.  Parts are faded or missing.']"
image58022,What is the style of the artwork depicted in the photograph?,"['Roman fresco', 'wall painting']"
image58022,What kind of architectural feature is visible in the image?,"['Wall paneling with a rectangular framed element, possibly a niche']"
image58022,What part of the building is depicted in the photograph?,['Detail of the eastern end of the north wall of a large oecus']
image58039,What can be observed besides the cupid in the image?,"['Graffiti or markings on the wall', 'A crack or fissure in the wall']"
image58039,What is depicted in the image?,"['A painted flying cupid', 'A winged cherub', 'A fresco of a putto']"
image58039,What is the color of the background?,"['Reddish-brown', 'Terracotta', 'A muted orange']"
image58039,What is the condition of the painting?,"['Fragmented', 'Damaged', 'Partially preserved', 'Shows signs of wear and tear']"
image58039,What is the style of the cupid depiction?,"['Classical', 'Roman', 'Possibly Hellenistic, reflecting influence from Greek art']"
image58039,What kind of paint was likely used?,"['Fresco paint', 'Pigments on plaster']"
image58040,What is the background color of the painting?,['A dark reddish-brown']
image58040,What is the condition of the painting in the image?,"[""The painting appears aged and shows signs of damage or deterioration; the colors are faded, and there's evidence of surface wear.""]"
image58040,What is the image depicting?,['A painted flying cupid']
image58040,What is the location of the cupid within the building?,['North end of the east wall']
image58040,What is the subject's attire in the painting?,"['The cupid is depicted nude, with a drape or cloth partially covering its lower body.']"
image58204,On which wall of the portico is the painting located?,['West wall of the north portico']
image58204,What additional objects are visible in the foreground of the painting besides Mars and Venus?,"['Weapons (possibly)', 'A shield or similar object']"
image58204,What appears to be on Venus's head?,['A hat or headdress']
image58204,What is depicted in the wall painting?,['Mars and Venus']
image58204,What is the apparent style of the wall painting?,"['Classical', 'Roman', 'Possibly mythological']"
image58204,What is the background of the painting like?,"['A landscape with mountains or hills', 'Possibly a stylized or idyllic representation']"
image58204,What is the condition of the painting?,"['It appears somewhat faded or damaged', 'The colors seem muted', ""It's displayed behind protective glass""]"
image58364,Describe the condition of the painting in the photograph.,"['The painting shows signs of age and damage, including some discoloration and chipping of the paint.  The colors are faded and the surface appears worn.']"
image58364,What is the painting's style?,"['Wall painting', 'Roman fresco']"
image58364,What is the subject of the painting?,"['A mythological scene involving Aphrodite and Ares; It appears to show a narrative possibly relating to a meeting, an interaction or a scene from their shared mythology.']"
image58364,What wall of which room does the painting decorate?,['North wall of the tablinum']
image58364,Who are the main figures depicted in the wall painting?,['Aphrodite and Ares']
image58598,Describe the figures in the painting.,"['A reclining, possibly wounded, figure (Adonis) with a smaller child-like figure interacting with them. There appears to be a spear or staff.', 'A semi-nude figure possibly representing Adonis, a child, and what seems to be a dog or similar animal at the bottom.']"
image58598,What is depicted in the central painting of Room 10 in Pompeii?,['Adone Ferito (the wounded Adonis)']
image58598,What is the condition of the painting?,"['It appears to be somewhat faded or damaged, showing signs of age and deterioration.', 'The fresco shows signs of damage and weathering.']"
image58598,What is the filename of this photograph?,['J59f0480']
image58598,What is the overall color scheme of the painting and its frame?,"['The painting has muted colors, predominantly light yellows, browns, and muted flesh tones; the frame is darker brown.']"
image58721,What appears to be next to the fountain basin?,"['A bird, possibly a type of crane or similar long-legged bird']"
image58721,What could be the symbolic meaning of the painting?,"['Possible interpretations include themes of love (Cupid), abundance (water/fountain), and nature (tree and bird).  A more specific interpretation would require further art historical analysis.']"
image58721,What is depicted in the painting?,"['A painted cupid, a jug, a fountain basin, and a tree.']"
image58721,What is the color palette of the painting?,"['The dominant colors appear to be muted greens, reds/browns, and possibly some yellows or lighter tones, given the age and damage to the fresco.']"
image58721,What is the condition of the painting?,['The painting shows signs of age and damage; some details are indistinct and faded.']
image58721,What is the cupid doing?,['The cupid appears to be interacting with or near the jug and fountain basin.']
image58721,What is the overall style of the painting?,"['It appears to be a classical or Roman style fresco, common in Pompeii.']"
image58919,Describe the cupid's appearance.,"['A small, winged, naked child-like figure.']"
image58919,What is depicted in the image?,['A flying cupid (or putto) playing a pan-pipe.']
image58919,What is the background color of the image?,['Red']
image58919,What is the image's file designation in the archive?,['J68f2047']
image58919,What type of instrument is the cupid playing?,['Pan-pipe']
image59456,What is depicted in the image?,"['A detail of a painted flying cupid.', 'A fragment of a fresco showing a cupid in flight.']"
image59456,What is the artistic style of the cupid painting?,"[""It's difficult to determine the exact style from the image alone.  Further information would be needed."", 'Potentially Roman fresco style.']"
