id,query,answers
0013.01,Describe the shapes used in the artwork.,"['Triangles, curved lines, and abstract shapes.', 'Dynamic and overlapping shapes.', 'Geometric shapes in varying sizes and orientations.']"
0013.01,Is there any indication of texture in the image?,"['The image suggests a smooth painted surface.', 'There is no visible texture other than the painted design.']"
0013.01,What colors are predominantly used in the artwork?,"['Blues and greens.', 'Shades of teal, green, and blue.']"
0013.01,What is the lighting like in the image?,"[""There's a light fixture visible in the ceiling."", 'The lighting appears to be artificial, likely indoor lighting.', 'The lighting is relatively even across the artwork.']"
0013.01,What is the main subject of the image?,"['A mural or painted artwork on a curved wall.', 'An abstract geometric design painted on a wall.']"
0013.01,What is the style of the artwork?,"['Abstract.', 'Geometric.', 'Modern.']"
0013.01,What kind of surface is the artwork painted on?,"['A curved wall.', 'A concave wall, possibly part of a stairwell or corridor.']"
0013.01,What might be the location of this artwork?,"['A public building.', 'An office building.', 'A school or community center.', 'A stairwell or hallway.']"
image10861,What are some of the elements depicted in the wall painting?,"['Floating figures', 'Cupid hunting', 'Plants', 'Birds']"
image10861,What is depicted in the photograph?,"['A wall painting in a triclinium (dining room)', 'A fresco showing floating figures, a cupid hunting, plants, and birds', 'Roman wall art']"
image10861,What is the color scheme of the wall painting?,"['Red, yellow, black, and other muted tones', 'Predominantly red and yellow with dark accents']"
image10861,What is the condition of the wall painting?,"['Fragmented', 'Damaged', 'Partially preserved', 'Shows signs of age and decay']"
image10861,What is the location of the wall painting in the building?,['Triclinium 6 west wall']
image10861,What style of painting is shown?,"['Roman fresco', 'Wall painting']"
image10861,What type of scene is suggested by the painting?,"['Mythological or allegorical', 'Possibly a hunting scene given the presence of cupid']"
image11218,What features are visible on the walls of the corridor?,"['Traces of frescoes or wall paintings', 'Different shades of red and brown pigments', 'Signs of age and decay']"
image11218,What features suggest the location is an ancient Roman site?,"['The style of architecture, the materials used, the state of preservation']"
image11218,What is the architectural feature being viewed in the image?,['Entrance corridor/fauces']
image11218,What is the architectural feature being viewed in the image?,['entrance corridor/fauces']
image11218,What is the condition of the structures depicted in the image?,"['ruined, partially excavated', 'showing signs of age and decay', 'some areas have been restored or stabilized']"
image11218,What is the direction the photographer is looking in the image?,['North']
image11218,What is the general state of preservation of the building shown?,"['Ruined but still showing architectural details', 'Partially excavated and exposed to the elements']"
image11218,What is the general style of the architecture?,"['Roman', 'Ancient Roman']"
image11218,What is visible at the end of the corridor?,"['a courtyard or atrium, with a small pool or impluvium', 'remains of walls and a structure, potentially a shrine or alcove']"
image11218,What is visible at the end of the corridor?,"['A courtyard', 'A small garden area', 'A structure with a niche or alcove']"
image11218,What kind of flooring is visible in the corridor and the courtyard?,"['Stone paving', 'Mosaic tiles (partially visible in the courtyard)']"
image11218,What kind of structures are visible in the background?,"['Roman buildings, possibly part of a domus (house)']"
image11218,What might be the purpose of the enclosed area at the end of the corridor?,"['A garden (impluvium)', 'An atrium', 'A space for relaxation or gathering']"
image11218,What type of material appears to be used on the walls?,"['stone, possibly volcanic rock; plaster with remnants of frescoes or paintings']"
image11218,What type of structure is shown in the image?,"['Roman House (domus)', 'Ruins of a Roman building in Pompeii']"
image11252,What additional information would be useful to better interpret the image and the frescoes?,"['High-resolution images, scholarly analysis of the frescoes, descriptions of similar paintings from Pompeii, and information about the overall layout of the house.']"
image11252,What can be inferred about the social status of the inhabitants of this house based on the presence of an oecus?,"['The inhabitants were likely of relatively high social standing, as oecus were common in larger, more elaborate Roman houses.']"
image11252,What is the most prominent feature on the wall?,"['A series of wall paintings or frescoes depicting scenes, possibly related to daily life or mythology.']"
image11252,What is the state of preservation of the wall paintings?,"['They are partially preserved, with some sections damaged or faded.  The colors are muted and some details are difficult to discern.']"
image11252,What material appears to make up the walls of the room?,"['Stone or brick, given the texture and visible blocks.']"
image11252,What style of Roman painting is represented in the image (based on visual observation)?,"[""It appears to have elements of Second Pompeian Style  (or possibly elements of earlier styles due to degradation).  Characteristics include architectural elements and figures in landscape/narrative scenes.""]"
image11252,What type of structure is shown in the image?,"['A room, specifically an oecus (a formal reception room in a Roman house)']"
image11913,"What is the condition of the artwork, as suggested by the image?","['It appears to have some damage or deterioration, particularly in the upper left corner.', 'It shows signs of age and wear.']"
image11913,What are the figures shaking called?,['Sistra']
image11913,What is depicted in the image?,"['The arrival of Io, a figure with horns, being cared for by a sea deity at Canopus.', 'Isis offering her hand to Io while her priestesses shake sistra.', 'A scene showing a mythological event involving Io, Isis, and her priestesses.']"
image11913,What is the role of the figure offering her hand to Io?,['Isis']
image11913,What is the significance of Io having horns?,"[""It's a mythological detail associated with her transformation by Zeus.""]"
image11913,What is the significance of the location in the context of the mythology?,['Canopus was an ancient Egyptian city and port associated with various religious and mythological figures.']
image11913,What kind of deity is assisting Io?,['A sea deity']
image11913,Who is the central figure receiving assistance?,['Io']
image12036,What colors are predominantly visible in the painting?,"['Muted greens, browns, and possibly some faded blues and reds']"
image12036,What is depicted in the wall painting?,"['A cherub scared by a tragic mask held by a nymph', 'A nymph holding a tragic mask, with a scared cherub nearby']"
image12036,What is the overall condition of the painting?,"['Somewhat faded and damaged, showing signs of age and deterioration.', 'The paint is partially flaked and worn.']"
image12036,What is the style of the painting?,['Ancient Roman wall painting']
image12036,What might the painting symbolize?,"['The contrast between joy (the cherub) and sorrow (the tragic mask)', 'A scene from mythology or literature', 'A representation of human emotions']"
image12440,What city is depicted in the image?,['Pompeii']
image12440,What colors are prominent in the remaining parts of the painting?,"['Red, Yellow, light blues/grays']"
image12440,What is depicted in the wall painting?,"['A scene, potentially showing architecture, figures, and landscape elements (though details are unclear due to damage).  The style suggests a Roman domestic setting.']"
image12440,What is the condition of the wall painting?,['Damaged; parts are missing or severely deteriorated.']
image12440,What is the subject of the image?,['A wall painting']
image12440,What style of painting does the wall painting appear to be?,['Roman fresco painting.  The architectural elements suggest a style common in Roman domestic decoration.']
image12494,What can you infer about the age of this artwork based on the context?,"[""It's likely from the Roman period, given that it was found in Pompeii.""]"
image12494,What is depicted in the image?,"['A detail of a face in a medallion', ""A fragment of a fresco showing a person's face""]"
image12494,What is the condition of the artwork?,"['Damaged', 'Fragmentary', 'Partially preserved', 'Deteriorated']"
image12494,What is the likely material of the artwork shown in the image?,['Fresco']
image12498,What is depicted in the image?,"['A detail of a face on a medallion.', 'A fragment of a fresco showing a face within a circular frame.', 'A close-up of a weathered and damaged painting of a face.']"
image12498,What is the condition of the depicted artwork?,"['The artwork is heavily weathered and damaged.', 'The colors are faded and indistinct.', 'Much of the detail of the face is lost to decay.']"
image12498,What is the likely material of the medallion?,"[""It's difficult to definitively determine from the image, but it could be plaster or a similar material commonly used for wall paintings in Pompeii.""]"
image12498,What is the significance of the location mentioned in the image description?,"['The location suggests the image is part of a larger Roman fresco or wall painting.', 'The tablinum was an important room in a Roman house, usually used as a formal reception area.', 'The specific location within the tablinum helps to provide context for the art piece.']"
image12498,What kind of art is this likely to be?,['Roman fresco painting']
image12951,How many panels are described on each wall?,['Three']
image12951,What appears to be depicted in the central painting on the visible wall?,"['A figure or scene, although details are difficult to make out from the image.']"
image12951,What architectural features are visible in the image?,"['A doorway', 'A north wall', 'A lower dado (painted red)', 'A cornice of painted stucco (at the top of the wall)']"
image12951,What color are the walls?,['Yellow']
image12951,What color is the lower part of the wall?,['Red']
image12951,What is located at the top of the wall?,['A cornice of painted stucco']
image12951,What is visible through the doorway?,['Another room or part of the building']
image13064,What does the graffito appear to say?,['Helvium aed(ilem)']
image13064,What does the abbreviation 'aed(ilem)' likely stand for?,['Aedilis (a Roman magistrate)']
image13064,What is depicted in the painting shown in the image?,"['A painting of Venus Pompeiana.', 'A figure that is likely Venus, along with putti (cherubs) and what appears to be a child or young attendant.']"
image13064,What is the location of the graffito relative to the painting of Venus?,['Lower left']
image13950,What is the location depicted in the image?,"['A cubiculum in Pompeii', 'A room on the south side of a peristyle in Pompeii']"
image13950,What is the overall state of preservation of the room shown in the image?,"['The room shows significant signs of age and deterioration. The walls are damaged, and the paintings are faded and incomplete.']"
image13950,What is the status of the paintings on the north and west walls?,"['The painting on the north wall (door wall) was destroyed.', 'The painting on the west wall was replaced by a window.']"
image13950,What scene is depicted in the painting on the east wall?,['Andromeda being liberated by Perseus']
image13952,What appears to be in the central square of the painting?,"[""A faded figure or scene; it's difficult to say definitively due to the damage."", 'A partially preserved image, possibly depicting a human figure or an object.']"
image13952,What colors are present in the wall painting?,"['Red, yellow/ochre', 'A faded red dominates the central area, while yellowish tones are visible on the sides.']"
image13952,What is depicted in the image?,"['A section of a wall in Pompeii, showing faded frescoes.', 'A wall painting with a central, damaged square panel and surrounding colored areas.', 'A fragment of Roman wall art, showing signs of age and deterioration.']"
image13952,What is the state of preservation of the fresco?,"['Poor; it is significantly faded and damaged.', 'The fresco is heavily deteriorated, with significant loss of pigment and detail.']"
image13952,What is the style of the wall painting?,"['It appears to be in a Roman style, common in Pompeian domestic settings.']"
image13952,What type of room is the cubiculum?,['A bedroom']
image13953,Describe the decorative elements visible in the image.,"['Painted frieze with possibly figural or decorative motifs', 'Stucco work in the corner', 'Traces of paint and plaster']"
image13953,What architectural feature is highlighted in the image?,"['Frieze', 'Plaster stucco', 'Corner of a room (cubiculum)', 'Window (mentioned in the description)']"
image13953,What is the color of the main wall area visible in the image?,"['Red', 'Reddish-orange', 'Ochre']"
image13953,What is the location of the window mentioned in the description?,"['West wall', 'Overlooking the garden']"
image13953,What is the state of preservation of the frieze and stucco?,"['Damaged', 'Partially preserved', 'Shows signs of age and deterioration', 'Some areas are missing plaster']"
image13953,What type of room is depicted in the image?,['Cubiculum (bedroom)']
image14198,What is Cupid holding?,['A sword']
image14198,What is depicted in the wall painting?,"['A Cupid', 'A Cupid holding a sword']"
image14198,What is the condition of the wall painting?,"['Somewhat damaged or faded', 'Shows signs of age and wear']"
image14198,What is the likely style of the artwork?,"['Roman fresco', 'Pompeian wall painting']"
image14200,"Based on the image quality, what might be some challenges in fully appreciating the original painting?","[""The photo's resolution and lighting might not capture the finer details and original vibrancy of colors. Damage to the painting itself makes some details indistinguishable.""]"
image14200,What appears to be the material of the wall on which the painting is found?,"['Plaster or a similar material, possibly aged and showing wear.']"
image14200,What can you infer about the age of the painting?,"[""It's ancient, given its location in Pompeii, and likely dates back to the time of the Roman Empire.""]"
image14200,What colors are predominantly visible in the painting?,['Reddish-brown (for the cupid) and hints of green']
image14200,What is depicted in the wall painting?,['A flying cupid']
image14200,What is the condition of the wall painting?,['Somewhat faded and damaged; the colors are muted and some parts seem to be worn or lost.']
image14200,What is the location of the wall painting within the building?,['West wall of a bedroom on the west side of the atrium.']
image14203,What colors are prominently visible in the remaining parts of the painting?,"['Reds and browns (for the cupid)', 'Greens (possibly for foliage or clothing details)']"
image14203,What is depicted in the wall painting?,"['A flying cupid', 'A putto (child-like angel) with wings (implied by the flying posture) carrying a spear or staff']"
image14203,What is the condition of the wall painting?,"['Damaged or deteriorated', 'The plaster shows cracks and some parts of the painting may be lost', 'Fragmentary, showing signs of age and wear']"
image14203,What is the likely age or time period of the wall painting?,"['Roman era', 'Ancient Roman', ""The painting dates back to the time of Pompeii's existence before the eruption of Mount Vesuvius""]"
image14203,What object is the cupid carrying?,"['A spear or staff', 'A long, thin object that could be interpreted as either a spear or a staff']"
image14219,What are some of the visible features on the wall besides the painting?,"['Rough texture, patches of missing plaster, brickwork']"
image14219,What can be inferred about the materials used in the wall and the painting?,"['The wall appears to be made of a type of plaster or concrete. The paint is likely a fresco, but the exact medium cannot be determined from the image alone.']"
image14219,What is depicted in the image?,"['Painted decoration on a wall', 'Remnants of a fresco or wall painting', 'A deteriorated painted wall in an ancient Roman building']"
image14219,What is the specific location of the painted decoration within the cubiculum?,['North-west corner']
image14219,What is the state of preservation of the painted decoration?,"['Poorly preserved', 'Deteriorated', 'Fragmented', 'Partially damaged']"
image14219,What type of room is this located in?,['Cubiculum (bedroom)']
image14351,What does Cupid appear to be holding or carrying?,"[""It's difficult to say for certain due to the damage, but it appears to be some kind of object or possibly a small bundle.""]"
image14351,What is depicted in the image?,"['A detail of a wall painting of Cupid.', 'A partially preserved fresco of a winged figure, likely Cupid.']"
image14351,What is the color scheme of the background visible in the image?,"['Predominantly yellow.', 'Yellow with red and possibly other colors in the borders.']"
image14351,What is the state of preservation of the painting?,"['Fragmented.', 'Partially damaged.', 'Shows significant damage and loss of paint.', 'The painting is incomplete and deteriorated.']"
image14351,What style of painting does this appear to be?,"['Fresco painting', 'Roman wall painting']"
image14352,"Based on the image, what can you infer about the style of the painting?","['It appears to be a relatively simple style, possibly from a less elaborate part of the house.', 'The style is consistent with the Roman frescoes from the period.', 'The figure is rendered in a somewhat stylized manner rather than with realistic detail.']"
image14352,What is a cubiculum?,['A bedroom in a Roman house.']
image14352,What is depicted in the photograph?,"['A detail of a wall painting of Cupid.', 'A fragment of a Roman fresco showing a figure that appears to be Cupid.']"
image14352,What is the condition of the painting?,"['Damaged and partially destroyed.', 'It shows significant signs of age and deterioration.', 'The paint is flaking and the surface is cracked.']"
image14352,What is the overall color scheme of the painting and the surrounding wall?,"['Yellow, with reddish-brown borders.', 'The dominant color is a yellowish ochre.']"
image14352,What is the subject of the wall painting?,['Cupid']
image14352,What part of the room is the painting located on?,['The west end of the south wall of a cubiculum.']
image14352,What type of art is the painting likely to be an example of?,"['Roman fresco painting', 'Pompeian wall painting']"
image14359,Describe the style of the painting.,"['Simple, possibly faded or damaged', 'The figure is somewhat indistinct', 'The color palette seems limited (predominantly white against a red background)']"
image14359,What is depicted in the image?,"['A detail of a wall painting', 'A floating figure', 'A figure with wings (possibly an angel or similar mythological being)']"
image14359,What is the condition of the painting?,"['It appears to be somewhat damaged or faded', 'There are cracks visible in the surface beneath the painting.']"
image14359,What is the surface on which the painting is located?,['A wall']
image14359,What might the symbolic meaning of the figure be?,"['Given the wings, it could represent an angel, a spirit, a mythological being, or a symbol of freedom/spiritual transcendence.  Further analysis would be needed to determine a definitive meaning.', 'The meaning depends heavily on broader context within the triclinium and the Pompeii site.']"
image14359,What type of room was this painting found in?,['Triclinium (a Roman dining room)']
image14364,What appears to be depicted in the green panel?,"['A figure, possibly a person or deity, though details are unclear due to damage.', 'An indistinct scene or image.']"
image14364,What can be inferred about the original appearance of the wall based on what remains?,"['The wall was likely richly decorated with a more extensive scheme of colorful frescoes, organized into distinct panels.', 'There might have been a more complex scene depicted, given the size of the missing fragments.']"
image14364,What colors are predominantly visible in the preserved sections of the wall paintings?,['Red and green']
image14364,What is depicted in the image?,"['A section of a west wall in a triclinium (dining room) in Pompeii.', 'A wall with remnants of ancient Roman frescoes or wall paintings.', 'Partially preserved wall paintings showing red and green panels with some figural elements.']"
image14364,What is the state of preservation of the wall paintings?,"['The wall paintings are partially damaged and deteriorated.', 'Significant portions of the paintings are missing or severely damaged.', 'There are large areas of missing plaster, exposing the underlying wall.']"
image14364,What is the style of the visible wall paintings?,"[""Roman fresco style, indicating it's from the Roman era.""]"
image14364,What kind of architectural space is this wall a part of?,['A triclinium (Roman dining room)']
image14749,What is depicted in the fresco shown in the image?,"['A series of panels with figures and possibly a landscape or border.', 'At least one figure appears to be a human-like being carrying something (possibly a branch or staff).', 'Another panel seems to contain an animal (possibly a bear or similar creature).']"
image14749,What is the state of preservation of the fresco?,"['The fresco shows signs of age and damage; the colors are faded, and parts are unclear or deteriorated.', 'Some areas are more preserved than others.']"
image14749,What is the style of the fresco?,"['It appears to be a Roman fresco, given the location and style of painting.', 'It seems to be using a relatively simple palette of colors (reds, browns, blues).']"
image14749,What part of the room is shown in the image?,['A detail from the south wall of the Tablinum']
image14749,What type of building is a Tablinum?,['A Tablinum was typically the main reception room or formal office in a Roman domus (house).']
image14844,What colors are visible in the remaining painted section?,"['Green', 'White/Off-white', 'Possibly other faded colors']"
image14844,What is depicted in the painted wall panel?,['Cupids picking grapes']
image14844,What is the condition of the painted wall panel?,"['Fragmented', 'Damaged', 'Broken into pieces']"
image14844,What is the likely subject matter of the artwork considering the context of Pompeii?,"['Mythological scene', 'Bacchic scene (related to wine and celebration)']"
image14844,What kind of artistic technique is likely used in the painted panel?,['Fresco painting']
image14844,What type of material is the wall panel made of?,['Plaster']
image14847,"What is the color scheme of the painting, based on the image?","['Muted reds and browns', 'Earth tones']"
image14847,What appears to be the subject matter of the painting?,"['Mythological figures (cupids)', 'possibly a playful or romantic scene']"
image14847,What architectural features surround the painting?,['A rectangular border or frame']
image14847,What is depicted in the image?,"['A painted wall panel', 'Cupids', 'A detail of a painted wall panel showing cupids']"
image14847,What is the location of the panel within the room?,['Centre of the east wall']
image14847,What is the overall condition of the painting?,"['Somewhat faded or damaged', 'partially preserved']"
image14847,What type of art is depicted in the wall panel?,"['Painted wall panel', 'Fresco (likely, given the context of Pompeii)']"
image14851,What is depicted in the image?,"['The east wall of a room in Pompeii, showing heavily deteriorated frescoes or wall paintings.', ""A room's interior wall with remnants of ancient Roman wall art.""]"
image14851,What is the condition of the wall paintings?,"['Heavily deteriorated and faded.', 'Significant damage and loss of detail is evident.']"
image14851,What is the location of the room within the larger structure?,['North-west corner of the first level floor below ground.']
image14851,What type of wall paintings are visible?,"['Frescoes (though their exact style is difficult to determine due to the damage).', 'Wall paintings showing traces of various scenes and possibly decorative elements.']"
image15172,What architectural feature is prominently displayed on the wall?,"['Half-columns', 'A small, roofed structure resembling a shrine or alcove.']"
image15172,What is depicted in the image?,"['The south wall of a peristyle in Pompeii, showing a section with half-columns and a structure resembling a small shrine or alcove.', ""A portion of an ancient Roman building's wall, featuring architectural details such as half-columns and a roofed structure.""]"
image15172,What is the condition of the wall and its architectural features?,"['The wall shows signs of age and weathering; the plaster is damaged and incomplete. Some paint or pigment remains.', 'It is a ruin showing significant deterioration but retaining some architectural details.']"
image15172,What material appears to constitute the wall?,"['It appears to be constructed of volcanic rock or similar material, possibly tuff, common in the Pompeii area.', 'The wall seems to be made of stone or brick and plastered.']"
